"id","slug","name","summary","excerpt","roles","locations","organizations","tags","profileUrl","lastUpdated"
"person:kavir","kavir","Kavir","Kavir is in his second week with BC + AI (as of Feb 2026), making a bold career change from software-as-a-service implementation to agentic animation—entirely offline at home. Two months into this transition, he's wrestling with the technical challenge of running good reasoning LLMs locally within RAM constraints while battling imposter syndrome. Despite the struggles, he's making concrete progress: sound studio f...","Kavir is in his second week with BC + AI (as of Feb 2026), making a bold career change from software-as-a-service implementation to agentic animation—entirely offline at home. T...","Agentic Animation Developer","Vancouver","","animation|career-transition|local-ai|offline-ai","/bc-ai-directory/people/kavir","2026-05-15"
"person:kay-tigo","kay-tigo","Kay Tigo","Kay Tigo represents the Montreal AI Ethics Institute and appeared at Vancouver AI Meetup 23 (November 26, 2025) on the ethics panel. Their signature contribution: hard environmental impact data — a 5-second AI video = 3.4 million joules (equivalent to a 61 km e-bike ride); by 2028, AI will consume 326 terawatt hours/year (equivalent to 1,600 round trips to the sun). Most memorable moment came when asked ""How can A...","Kay Tigo represents the Montreal AI Ethics Institute and appeared at Vancouver AI Meetup 23 (November 26, 2025) on the ethics panel. Their signature contribution: hard environme...","AI Ethics Researcher|Community Panelist","Montreal, QC","Montreal AI Ethics Institute","accountability|ai-ethics|consent|environmental-impact|montreal-ai-ethics-institute|state-of-ai-ethics-report|transparency","/bc-ai-directory/people/kay-tigo","2026-05-15"
"person:kdodds","kdodds","kdodds","kdodds is a community member of the BC + AI Ecosystem. Limited public information is available for this profile as the name provided is a first name only or pseudonym, preventing reliable identification.","kdodds is a community member of the BC + AI Ecosystem. Limited public information is available for this profile as the name provided is a first name only or pseudonym, preventin...","","","","ai|british-columbia","/bc-ai-directory/people/kdodds","2026-05-13"
"person:kei-b","kei-b","Kei B","Kei B is a British Columbia-based community member of the BC + AI Ecosystem.","Kei B is a British Columbia-based community member of the BC + AI Ecosystem.","Community Member","British Columbia","","ai|british-columbia","/bc-ai-directory/people/kei-b","2026-05-13"
"person:keith","keith","Keith","Keith is a community member of the BC + AI Ecosystem. Limited public information is available for this profile as the name provided is a first name only or pseudonym, preventing reliable identification.","Keith is a community member of the BC + AI Ecosystem. Limited public information is available for this profile as the name provided is a first name only or pseudonym, preventing...","","","","ai|british-columbia","/bc-ai-directory/people/keith","2026-05-13"
"person:kelly-hack","kelly-hack","Kelly Hack","Kelly Hack is a British Columbia-based community member of the BC + AI Ecosystem.","Kelly Hack is a British Columbia-based community member of the BC + AI Ecosystem.","Community Member","British Columbia","","ai|british-columbia","/bc-ai-directory/people/kelly-hack","2026-05-13"
"person:kemp-edmonds","kemp-edmonds","Kemp Edmonds","Kemp Edmonds is a Vancouver-based technology community builder and active member of the BC + AI Ecosystem. A founding Braintrust member since May 2024, Kemp has contributed to organizing and building the Vancouver AI community. He was a speaker at Vancouver AI Meetup 18 in June 2024, presenting alongside his 12-year-old son Liam in a session that highlighted AI learning across generations.","Kemp Edmonds is a Vancouver-based technology community builder and active member of the BC + AI Ecosystem. A founding Braintrust member since May 2024, Kemp has contributed to o...","Community Builder|Technology Evangelist","Vancouver, British Columbia","Vancouver AI Meetup","ai|braintrust|community-building|vancouver-tech","/bc-ai-directory/people/kemp-edmonds","2026-05-13"
"person:kenneth-ip","kenneth-ip","Kenneth Ip","Kenneth Ip is a British Columbia-based community member of the BC + AI Ecosystem.","Kenneth Ip is a British Columbia-based community member of the BC + AI Ecosystem.","Community Member","British Columbia","","ai|british-columbia","/bc-ai-directory/people/kenneth-ip","2026-05-13"
"person:kenny-macintyre","kenny-macintyre","Kenny MacIntyre","Kenny MacIntyre is a British Columbia-based community member of the BC + AI Ecosystem.","Kenny MacIntyre is a British Columbia-based community member of the BC + AI Ecosystem.","Community Member","British Columbia","","ai|british-columbia","/bc-ai-directory/people/kenny-macintyre","2026-05-13"
"person:kerris","kerris","Kerris","Kerris is a community member of the BC + AI Ecosystem. Limited public information is available for this profile as the name provided is a first name only or pseudonym, preventing reliable identification.","Kerris is a community member of the BC + AI Ecosystem. Limited public information is available for this profile as the name provided is a first name only or pseudonym, preventin...","","","","ai|british-columbia","/bc-ai-directory/people/kerris","2026-05-13"
"person:keshav","keshav","Keshav","Keshav is a community member of the BC + AI Ecosystem. Limited public information is available for this profile as the name provided is a first name only or pseudonym, preventing reliable identification.","Keshav is a community member of the BC + AI Ecosystem. Limited public information is available for this profile as the name provided is a first name only or pseudonym, preventin...","","","","ai|british-columbia","/bc-ai-directory/people/keshav","2026-05-13"
"person:kevin","kevin","Kevin","Kevin is a Vancouver-based consultant affiliated with Kevin Hayes Consulting, engaged with the BC + AI Ecosystem community. Note: This may be a duplicate profile for Kevin Hayes; see people/kevin-hayes.","Kevin is a Vancouver-based consultant affiliated with Kevin Hayes Consulting, engaged with the BC + AI Ecosystem community. Note: This may be a duplicate profile for Kevin Hayes...","Community Member|Consultant","Vancouver, British Columbia","Kevin Hayes Consulting","ai|consulting|vancouver-tech","/bc-ai-directory/people/kevin","2026-05-13"
"person:kevin-game-dev-nutrition-ai","kevin-game-dev-nutrition-ai","Kevin (Game Dev / Nutrition AI)","Kevin is a game developer and UX designer with 15 years of experience who recently wound down his solo AI startup focused on gamifying nutrition (""Ad Monster"") after facing funding challenges. He pivoted to contract work with a medical AI SaaS company, specializing in MCP (Model Context Protocol) integration with Figma, refactoring design systems, and bridging AI-assisted development with traditional hand-coding a...","Kevin is a game developer and UX designer with 15 years of experience who recently wound down his solo AI startup focused on gamifying nutrition (""Ad Monster"") after facing fund...","Game Developer|Medical AI SaaS Contractor|UX Designer","Vancouver, BC","","claude-code|figma|game-development|mcp|medical-ai|nutrition-gamification|startup|ux-design","/bc-ai-directory/people/kevin-game-dev-nutrition-ai","2026-05-15"
"person:kevin-deng","kevin-deng","Kevin Deng","Kevin Deng is a British Columbia-based community member of the BC + AI Ecosystem.","Kevin Deng is a British Columbia-based community member of the BC + AI Ecosystem.","Community Member","British Columbia","","ai|british-columbia","/bc-ai-directory/people/kevin-deng","2026-05-13"
"person:kevin-friel","kevin-friel","Kevin Friel","Kevin Friel is a Vancouver-based independent consultant engaged with the BC + AI Ecosystem community.","Kevin Friel is a Vancouver-based independent consultant engaged with the BC + AI Ecosystem community.","Community Member|Consultant","Vancouver, British Columbia","Kevin Friel Consulting","ai|consulting|vancouver-tech","/bc-ai-directory/people/kevin-friel","2026-05-13"
"person:kevin-grandia","kevin-grandia","Kevin Grandia","Kevin Grandia is a Vancouver-based communications and media professional at Spake Media, engaged with the BC + AI Ecosystem community. Kevin has a background in digital communications and media production.","Kevin Grandia is a Vancouver-based communications and media professional at Spake Media, engaged with the BC + AI Ecosystem community. Kevin has a background in digital communic...","Communications and Media Professional|Community Member","Vancouver, British Columbia","Spake Media","ai|communications|digital-media|media|vancouver-tech","/bc-ai-directory/people/kevin-grandia","2026-05-13"
"person:kevin-hayes","kevin-hayes","Kevin Hayes","Kevin Hayes is a Vancouver-based consultant engaged with the BC + AI Ecosystem community.","Kevin Hayes is a Vancouver-based consultant engaged with the BC + AI Ecosystem community.","Community Member|Consultant","Vancouver, British Columbia","Kevin Hayes Consulting","ai|consulting|vancouver-tech","/bc-ai-directory/people/kevin-hayes","2026-05-13"
"person:kevin-sutton","kevin-sutton","Kevin Sutton","Kevin Sutton is a copywriter at Cedar Electronics who took Peter Bittner's AI course previously and returned for Cohort 8 because ""multivariate prompting changed the way I wrote and thought."" Known for articulating the power of using past work as AI context — feeding the AI things you've already written that you don't think about, and watching it synthesize them. Kevin brought colleagues Chad (creative director) a...","Kevin Sutton is a copywriter at Cedar Electronics who took Peter Bittner's AI course previously and returned for Cohort 8 because ""multivariate prompting changed the way I wrote...","Copywriter|Marketing Professional","British Columbia","Cedar Electronics","ai-upgrade|b2b-sales|copywriting|marketing|multivariate-prompting","/bc-ai-directory/people/kevin-sutton","2026-05-15"
"person:kevin-thomas","kevin-thomas","Kevin Thomas","Kevin Thomas is a British Columbia-based community member of the BC + AI Ecosystem.","Kevin Thomas is a British Columbia-based community member of the BC + AI Ecosystem.","Community Member","British Columbia","","ai|british-columbia","/bc-ai-directory/people/kevin-thomas","2026-05-13"
"person:kg","kg","KG","KG is a community member of the BC + AI Ecosystem. Limited public information is available for this profile as the name provided is a first name only or pseudonym, preventing reliable identification.","KG is a community member of the BC + AI Ecosystem. Limited public information is available for this profile as the name provided is a first name only or pseudonym, preventing re...","","","","ai|british-columbia","/bc-ai-directory/people/kg","2026-05-13"
"person:khelsilem-rivers","khelsilem-rivers","Khelsilem Rivers","Khelsilem Rivers is a British Columbia-based community member of the BC + AI Ecosystem. The name suggests possible Indigenous community connections.","Khelsilem Rivers is a British Columbia-based community member of the BC + AI Ecosystem. The name suggests possible Indigenous community connections.","Community Member","British Columbia","","ai|british-columbia|indigenous","/bc-ai-directory/people/khelsilem-rivers","2026-05-13"
"person:khristine-carino","khristine-carino","khristine carino","Khristine Carino is a British Columbia-based community member of the BC + AI Ecosystem.","Khristine Carino is a British Columbia-based community member of the BC + AI Ecosystem.","Community Member","British Columbia","","ai|british-columbia","/bc-ai-directory/people/khristine-carino","2026-05-13"
"person:kieron-bryan","kieron-bryan","Kieron Bryan","Kieron Bryan is a journalist and filmmaker affiliated with ITN (Independent Television News), engaged with the BC + AI Ecosystem community. ITN is a major UK-based news organization producing content for ITV, Channel 4 News, and 5 News.","Kieron Bryan is a journalist and filmmaker affiliated with ITN (Independent Television News), engaged with the BC + AI Ecosystem community. ITN is a major UK-based news organiza...","Community Member|Filmmaker|Journalist","British Columbia","ITN (Independent Television News)","ai|film|journalism|media|television","/bc-ai-directory/people/kieron-bryan","2026-05-13"
"person:kiirsten-suurkask","kiirsten-suurkask","Kiirsten Suurkask","Kiirsten Suurkask is Founder and President of Tulevik Consulting Inc., based in Victoria, BC. With 20+ years of life sciences strategy and operational consulting experience, she advises clients in biotech and life sciences. Founded Tulevik Consulting in 2017. Life Sciences BC member. BC + AI Founding Member 171.","Kiirsten Suurkask is Founder and President of Tulevik Consulting Inc., based in Victoria, BC. With 20+ years of life sciences strategy and operational consulting experience, she...","Founder & President","Victoria, British Columbia","Tulevik Consulting Inc.","bc-ai|biotech|consulting|founding-member|life-sciences","/bc-ai-directory/people/kiirsten-suurkask","2026-05-15"
"person:kiran-pillay","kiran-pillay","Kiran Pillay","Kiran Pillay is a British Columbia-based community member of the BC + AI Ecosystem.","Kiran Pillay is a British Columbia-based community member of the BC + AI Ecosystem.","Community Member","British Columbia","","ai|british-columbia","/bc-ai-directory/people/kiran-pillay","2026-05-13"
"person:kiran-vaidya","kiran-vaidya","Kiran Vaidya","Kiran Vaidya is a British Columbia-based community member of the BC + AI Ecosystem.","Kiran Vaidya is a British Columbia-based community member of the BC + AI Ecosystem.","Community Member","British Columbia","","ai|british-columbia","/bc-ai-directory/people/kiran-vaidya","2026-05-13"
"person:kirby-brown","kirby-brown","Kirby Brown","Kirby Brown is a British Columbia-based community member of the BC + AI Ecosystem.","Kirby Brown is a British Columbia-based community member of the BC + AI Ecosystem.","Community Member","British Columbia","","ai|british-columbia","/bc-ai-directory/people/kirby-brown","2026-05-13"
"person:klaus-boedker","klaus-boedker","Klaus Boedker","Klaus Boedker is a Vancouver-based AI leadership coach and consultant behind Lead and Thrive with AI (leadandthrivewith.ai), focused on helping leaders and organizations navigate AI adoption. Engaged with the BC + AI Ecosystem community, Klaus brings expertise in leadership development through AI integration.","Klaus Boedker is a Vancouver-based AI leadership coach and consultant behind Lead and Thrive with AI (leadandthrivewith.ai), focused on helping leaders and organizations navigat...","AI Leadership Coach|Consultant","Vancouver, British Columbia","Lead and Thrive with AI","ai|ai-adoption|coaching|leadership|vancouver-tech","/bc-ai-directory/people/klaus-boedker","2026-05-13"
"person:knowles-adkisson","knowles-adkisson","Knowles Adkisson","Knowles Adkisson is a British Columbia-based community member of the BC + AI Ecosystem.","Knowles Adkisson is a British Columbia-based community member of the BC + AI Ecosystem.","Community Member","British Columbia","","ai|british-columbia","/bc-ai-directory/people/knowles-adkisson","2026-05-13"
"person:kobe","kobe","Kobe","Kobe is a community member of the BC + AI Ecosystem. Limited public information is available for this profile as the name provided is a first name only or pseudonym, preventing reliable identification.","Kobe is a community member of the BC + AI Ecosystem. Limited public information is available for this profile as the name provided is a first name only or pseudonym, preventing...","","","","ai|british-columbia","/bc-ai-directory/people/kobe","2026-05-13"
"person:kole","kole","Kole","Kole is a community member of the BC + AI Ecosystem. Limited public information is available for this profile as the name provided is a first name only or pseudonym, preventing reliable identification.","Kole is a community member of the BC + AI Ecosystem. Limited public information is available for this profile as the name provided is a first name only or pseudonym, preventing...","","","","ai|british-columbia","/bc-ai-directory/people/kole","2026-05-13"
"person:komilm","komilm","KomilM","KomilM is a community member of the BC + AI Ecosystem. Limited public information is available for this profile as the name provided is a first name only or pseudonym, preventing reliable identification.","KomilM is a community member of the BC + AI Ecosystem. Limited public information is available for this profile as the name provided is a first name only or pseudonym, preventin...","","","","ai|british-columbia","/bc-ai-directory/people/komilm","2026-05-13"
"person:kripa","kripa","Kripa","Kripa is a community member of the BC + AI Ecosystem. Limited public information is available for this profile as the name provided is a first name only or pseudonym, preventing reliable identification.","Kripa is a community member of the BC + AI Ecosystem. Limited public information is available for this profile as the name provided is a first name only or pseudonym, preventing...","","","","ai|british-columbia","/bc-ai-directory/people/kripa","2026-05-13"
"person:kripa-salvaya","kripa-salvaya","Kripa Salvaya","Kripa Salvaya is a Vancouver-based professional engaged with the BC + AI Ecosystem community.","Kripa Salvaya is a Vancouver-based professional engaged with the BC + AI Ecosystem community.","Community Member","Vancouver, British Columbia","","ai|vancouver-tech","/bc-ai-directory/people/kripa-salvaya","2026-05-13"
"person:kris-kr-archived","kris-kr-archived","Kris Kr","Kris Kr is a British Columbia-based community member of the BC + AI Ecosystem.","Kris Kr is a British Columbia-based community member of the BC + AI Ecosystem.","Community Member","British Columbia","","ai|british-columbia","/bc-ai-directory/people/kris-kr-archived","2026-05-13"
"person:kristen-delphos","kristen-delphos","Kristen Delphos","Kristen Delphos is a British Columbia-based community member of the BC + AI Ecosystem.","Kristen Delphos is a British Columbia-based community member of the BC + AI Ecosystem.","Community Member","British Columbia","","ai|british-columbia","/bc-ai-directory/people/kristen-delphos","2026-05-13"
"person:kristina-lao","kristina-lao","Kristina Lao","Kristina Lao is a British Columbia-based community member of the BC + AI Ecosystem.","Kristina Lao is a British Columbia-based community member of the BC + AI Ecosystem.","Community Member","British Columbia","","ai|british-columbia","/bc-ai-directory/people/kristina-lao","2026-05-13"
"person:krisxolotl","krisxolotl","krisxolotl 🖤❤️🔥✊🏴","Krisxolotl is a British Columbia-based community member of the BC + AI Ecosystem.","Krisxolotl is a British Columbia-based community member of the BC + AI Ecosystem.","Community Member","British Columbia","","ai|british-columbia","/bc-ai-directory/people/krisxolotl","2026-05-13"
"person:krystle","krystle","Krystle","Krystle is a community member of the BC + AI Ecosystem. Limited public information is available for this profile as the name provided is a first name only or pseudonym, preventing reliable identification.","Krystle is a community member of the BC + AI Ecosystem. Limited public information is available for this profile as the name provided is a first name only or pseudonym, preventi...","","","","ai|british-columbia","/bc-ai-directory/people/krystle","2026-05-13"
"person:kurt-archer","kurt-archer","Kurt Archer","Kurt Archer is a British Columbia-based community member of the BC + AI Ecosystem.","Kurt Archer is a British Columbia-based community member of the BC + AI Ecosystem.","Community Member","British Columbia","","ai|british-columbia","/bc-ai-directory/people/kurt-archer","2026-05-13"
"person:kurtis-kolt","kurtis-kolt","Kurtis Kolt","Kurtis Kolt is a Vancouver-based professional engaged with the BC + AI Ecosystem community.","Kurtis Kolt is a Vancouver-based professional engaged with the BC + AI Ecosystem community.","Community Member","Vancouver, British Columbia","","ai|vancouver-tech","/bc-ai-directory/people/kurtis-kolt","2026-05-13"
"person:kush-goenka","kush-goenka","Kush Goenka","Kush Goenka is a Vancouver-based professional engaged with the BC + AI Ecosystem community.","Kush Goenka is a Vancouver-based professional engaged with the BC + AI Ecosystem community.","Community Member","Vancouver, British Columbia","","ai|vancouver-tech","/bc-ai-directory/people/kush-goenka","2026-05-13"
"person:kyle-lindsay","kyle-lindsay","Kyle Lindsay","Kyle Lindsay is a British Columbia-based consulting professional affiliated with Pulsar Group, engaged with the BC + AI Ecosystem community.","Kyle Lindsay is a British Columbia-based consulting professional affiliated with Pulsar Group, engaged with the BC + AI Ecosystem community.","Community Member|Consulting Professional","British Columbia","Pulsar Group","ai|consulting|technology","/bc-ai-directory/people/kyle-lindsay","2026-05-13"
"person:kyle-treleaven","kyle-treleaven","Kyle Treleaven","Kyle Treleaven is Vice President and General Manager at BrainStation, the global leader in digital skills training, based in North Vancouver. He leads employee experience, consulting operations, and workforce development across both BrainStation and Konrad Group. His background spans tech entrepreneurship, e-commerce, and building high-performing teams, with a people-first approach to organizational growth and dig...","Kyle Treleaven is Vice President and General Manager at BrainStation, the global leader in digital skills training, based in North Vancouver. He leads employee experience, consu...","founding-member|Vice President & General Manager","North Vancouver, British Columbia","BrainStation|Konrad Group","bc-ai|digital-skills|edtech|founding-member|workforce-development","/bc-ai-directory/people/kyle-treleaven","2026-05-15"
"person:kyrani","kyrani","Kyrani","Kyrani is a community member of the BC + AI Ecosystem. Limited public information is available for this profile as the name provided is a first name only or pseudonym, preventing reliable identification.","Kyrani is a community member of the BC + AI Ecosystem. Limited public information is available for this profile as the name provided is a first name only or pseudonym, preventin...","","","","ai|british-columbia","/bc-ai-directory/people/kyrani","2026-05-13"
"person:laith-sarhan","laith-sarhan","Laith Sarhan","Laith Sarhan is the Founder and Principal Lawyer at Sarhan Data Law, a Vancouver firm specializing in data, privacy, and technology law. He is BC + AI Founding Member 99 and brings legal expertise to the intersection of law and artificial intelligence.","Laith Sarhan is the Founder and Principal Lawyer at Sarhan Data Law, a Vancouver firm specializing in data, privacy, and technology law. He is BC + AI Founding Member 99 and bri...","","Vancouver, British Columbia","","bc-ai|data-law|founding-member|legal|privacy","/bc-ai-directory/people/laith-sarhan","2026-05-14"
"person:lana-sutherland","lana-sutherland","Lana Sutherland","Lana Sutherland is the CEO and Co-Founder of TEALEAVES, a luxury hand-crafted tea company established in Vancouver, BC in 1994. Under her leadership, TEALEAVES has built an international reputation for blending ancient tea traditions with innovation, sustainability, and creative collaboration. The company is committed to biodiversity-positive supply chains and uses AI to predict climate volatility as part of its s...","Lana Sutherland is the CEO and Co-Founder of TEALEAVES, a luxury hand-crafted tea company established in Vancouver, BC in 1994. Under her leadership, TEALEAVES has built an inte...","CEO & Co-Founder|Entrepreneur|Sustainability Leader","Vancouver, BC","TEALEAVES","ai-community|entrepreneur|food-beverage|sustainability|tea|vancouver-community","/bc-ai-directory/people/lana-sutherland","2026-05-15"
"person:lance-james","lance-james","Lance James","Lance James is a community member in the BC + AI ecosystem. Limited public profile information available under this name in the BC AI context.","Lance James is a community member in the BC + AI ecosystem. Limited public profile information available under this name in the BC AI context.","","British Columbia","","bc-ai-community","/bc-ai-directory/people/lance-james","2026-05-14"
"person:landon-biotech-investment","landon-biotech-investment","Landon","Landon is a chemical engineer with biotech experience who owned a California healthcare company for 10 years, now Vancouver-based working with startups on investment readiness. Building AI companion to help score pitch decks (1: investment ready, 2: need little work, 3: need lots of work). Observes ""every startup has an AI angle these days, some more credible than others."" Gets energized by BC + AI community possi...","Landon is a chemical engineer with biotech experience who owned a California healthcare company for 10 years, now Vancouver-based working with startups on investment readiness....","Community Member","Vancouver, BC","","","/bc-ai-directory/people/landon-biotech-investment","2026-05-15"
"person:landon-steele","landon-steele","Landon Steele","Landon Steele is an active participant in the BC + AI community. Limited public profile information available under this name in the BC AI context.","Landon Steele is an active participant in the BC + AI community. Limited public profile information available under this name in the BC AI context.","","British Columbia","","bc-ai-community","/bc-ai-directory/people/landon-steele","2026-05-14"
