"id","slug","name","summary","excerpt","roles","locations","organizations","tags","profileUrl","lastUpdated"
"person:elayne-zalis","elayne-zalis","Elayne Zalis","Elayne Zalis, PhD, is a communications strategist and writer based in Los Angeles, serving as Principal Communications Strategist in Development at the University of California, Irvine. She specializes in crafting principal and transformational gift proposals for major donors at research universities and medical centers, having worked at Caltech and Cedars-Sinai Medical Center. She also explores personal and cultu...","Elayne Zalis, PhD, is a communications strategist and writer based in Los Angeles, serving as Principal Communications Strategist in Development at the University of California,...","Principal Communications Strategist|Writer","Los Angeles, California, United States","University of California, Irvine","communications|fundraising|higher-education|writing","/bc-ai-directory/people/elayne-zalis","2026-05-13"
"person:elias-molato","elias-molato","Elias Crespo Molato","Elias Crespo Molato is a Vancouver-based creative Webflow designer and developer specializing in high-end websites for tech companies, combining technical expertise with artistic flair. He studied visual arts at Emily Carr University of Art and Design and has background in software engineering and music production. His work emphasizes 3D graphics, GSAP animations, and performant Webflow builds.","Elias Crespo Molato is a Vancouver-based creative Webflow designer and developer specializing in high-end websites for tech companies, combining technical expertise with artisti...","Creative Webflow Designer and Developer","Vancouver, British Columbia","","creative-tech|design|front-end|web-design|webflow","/bc-ai-directory/people/elias-molato","2026-05-13"
"person:elif","elif","Elif","Elif is a BC + AI community member who appeared in the announcements channel in August 2025. Single first name only — limited public information available.","Elif is a BC + AI community member who appeared in the announcements channel in August 2025. Single first name only — limited public information available.","","","BC + AI","","/bc-ai-directory/people/elif","2026-05-13"
"person:eliza-noa","eliza-noa","Eliza Schwartzman & Noa Tutieski","Eliza Schwartzman and Noa Tutieski (both 16, grade 12) stood on stage at Surrey AI Meetup 8 (October 2025) and told the truth about AI in education: teachers use ChatGPT to write lesson plans on Monday, then punish students for using the same tool on Tuesday. Eliza's AP Psychology method: screenshot textbook pages, upload to AI, generate practice quizzes, identify knowledge gaps, repeat until mastery — not cheatin...","Eliza Schwartzman and Noa Tutieski (both 16, grade 12) stood on stage at Surrey AI Meetup 8 (October 2025) and told the truth about AI in education: teachers use ChatGPT to writ...","AI-in-Education Critics|Youth Voice","Surrey, BC","","ai-in-education|ap-psychology|calling-bullshit|debate-champion|gen-z|hidden-curriculum|surrey-ai|teacher-hypocrisy|youth-voice","/bc-ai-directory/people/eliza-noa","2026-05-15"
"person:ella-xie","ella-xie","Ella Xie","Ella Xie is a BC + AI community member who joined the announcements, events, and jobs channels in October 2025. No additional public information confirmed without risk of misidentification.","Ella Xie is a BC + AI community member who joined the announcements, events, and jobs channels in October 2025. No additional public information confirmed without risk of miside...","","","BC + AI","","/bc-ai-directory/people/ella-xie","2026-05-13"
"person:elsa","elsa","Elsa","Elsa is a BC + AI community member who appeared in announcements, jobs, and mindai channels in September 2025. Single first name only — not searchable without additional identifying information.","Elsa is a BC + AI community member who appeared in announcements, jobs, and mindai channels in September 2025. Single first name only — not searchable without additional identif...","","","BC + AI","","/bc-ai-directory/people/elsa","2026-05-13"
"person:emily-miller-palmquist","emily-miller-palmquist","Emily Miller Palmquist","Emily Miller Palmquist is a Lululemon raw materials innovation team lead who attended Vancouver AI Community events and is exploring AI training partnerships with TheUpgrade. She leads a team of 16 PhD-level researchers and raw materials designers focused on polymer research, with a third of the team based in APAC. Her team is experiencing AI fear and low Microsoft Copilot adoption, seeking training that makes AI...","Emily Miller Palmquist is a Lululemon raw materials innovation team lead who attended Vancouver AI Community events and is exploring AI training partnerships with TheUpgrade. Sh...","Community Member|Partnership Prospect","Vancouver, BC","Lululemon","","/bc-ai-directory/people/emily-miller-palmquist","2026-05-13"
"person:emin-ormeci","emin-ormeci","Emin Ormeci","Emin Ormeci (also known as Armin) is a Vancouver-based data strategist and consultant with a background in product management and data science from Turkey, including work at Getir (global on-demand delivery, $12B valuation) where he helped the company expand from Istanbul to nine countries. He relocated to Canada about a year ago and has been freelancing on data strategy and workflow automations for American and C...","Emin Ormeci (also known as Armin) is a Vancouver-based data strategist and consultant with a background in product management and data science from Turkey, including work at Get...","Data Strategist|Freelance Consultant|Transformation Consultant","Vancouver, British Columbia","KRV Logistics","agentic-ai|consulting|data-strategy|product-management|workflow-automation","/bc-ai-directory/people/emin-ormeci","2026-05-13"
"person:emre-akkas","emre-akkas","Emre Akkas","Emre Akkas is a Vancouver community member who attended Vancouver AI Community events in August 2025. He left constructive feedback about the community's mission clarity.","Emre Akkas is a Vancouver community member who attended Vancouver AI Community events in August 2025. He left constructive feedback about the community's mission clarity.","Community Member","Vancouver, British Columbia","","","/bc-ai-directory/people/emre-akkas","2026-05-13"
"person:enes-malik-yildiz","enes-malik-yildiz","Enes Malik Yıldız","Enes Malik Yıldız is an active BC + AI community member with 31 messages across six channels including the Film Club and Mind AI channels, suggesting interests in AI, film, and consciousness. Active from May 2025 through November 2025. A LinkedIn profile matching this name exists in Istanbul, Turkey — a Turkish connection is plausible given the name, but cannot be confirmed as the same person without additional id...","Enes Malik Yıldız is an active BC + AI community member with 31 messages across six channels including the Film Club and Mind AI channels, suggesting interests in AI, film, and...","","","BC + AI","ai-philosophy|community|film","/bc-ai-directory/people/enes-malik-yildiz","2026-05-13"
"person:enoch-venture-capital","enoch-venture-capital","Enoch","Venture capitalist who brings 17 years of deep AI product experience—specifically in computer vision since 2015—to a Vancouver-based VC firm investing across Canada. Made the significant career transition from long-term operational role to investment side in 2025, joining BC + AI community to understand the local startup landscape and explore how grassroots innovation can connect with formal capital. His arrival a...","Venture capitalist who brings 17 years of deep AI product experience—specifically in computer vision since 2015—to a Vancouver-based VC firm investing across Canada. Made the si...","AI Product Leader (former)|Computer Vision Specialist|Venture Capitalist","Vancouver, BC","","ai-products|community-fund|computer-vision|investment|startup-ecosystem|venture-capital","/bc-ai-directory/people/enoch-venture-capital","2026-05-13"
"person:enoch-chow","enoch-chow","Enoch Chow","Enoch Chow is a Vancouver-based AI product leader and investor associated with FOLD36 Capital, with experience building inclusive cultures in high-growth organizations. He is a BCIT alumnus who participated in the Braintrust channel in November 2025 and attended Vancouver AI Meetup 25.","Enoch Chow is a Vancouver-based AI product leader and investor associated with FOLD36 Capital, with experience building inclusive cultures in high-growth organizations. He is a...","AI Product Leader|Investor","Vancouver, British Columbia","FOLD36 Capital","ai-products|community|venture-capital","/bc-ai-directory/people/enoch-chow","2026-05-13"
"person:eric","eric","Eric","Eric is a BC + AI community member who appeared in announcements, events, and mindai channels in July–August 2025. Single first name only — not searchable without additional identifying information.","Eric is a BC + AI community member who appeared in announcements, events, and mindai channels in July–August 2025. Single first name only — not searchable without additional ide...","","","BC + AI","","/bc-ai-directory/people/eric","2026-05-13"
"person:eric-jackson","eric-jackson","Eric Jackson","Eric Jackson 45+ years developing robotic & telerobotic systems, primarily for subsea applications. Control systems engineer. Professional Information - Organization: Cellula Robotics - Title: Founder - Location: New Westminster, British Columbia BC + AI Founding Member - Member Number: 168","Eric Jackson 45+ years developing robotic & telerobotic systems, primarily for subsea applications. Control systems engineer. Professional Information - Organization: Cellula Ro...","founding-member","New Westminster, British Columbia","Cellula Robotics","bc-ai|founding-member","/bc-ai-directory/people/eric-jackson","2026-05-13"
"person:eric-lee","eric-lee","Eric Lee","Eric Lee is an early BC + AI Braintrust community member, active in May–June 2024 with 17 messages. Limited public information available — name is too common to search without additional identifiers.","Eric Lee is an early BC + AI Braintrust community member, active in May–June 2024 with 17 messages. Limited public information available — name is too common to search without a...","","","BC + AI","community","/bc-ai-directory/people/eric-lee","2026-05-13"
"person:eric-li","eric-li","Eric Li","Eric Li is a BC + AI community member who appeared in the announcements channel in August 2025. Limited public information available.","Eric Li is a BC + AI community member who appeared in the announcements channel in August 2025. Limited public information available.","","","BC + AI","","/bc-ai-directory/people/eric-li","2026-05-13"
"person:eric-ramirez","eric-ramirez","Eric Ramirez","Eric Ramirez is associated with Rolls Right Trucking Industries, a Western Canada 3PL logistics provider established in 1976 with 200,000+ sq ft of warehouse space across BC and Alberta. His specific role at Rolls Right is not publicly documented. Limited public information available.","Eric Ramirez is associated with Rolls Right Trucking Industries, a Western Canada 3PL logistics provider established in 1976 with 200,000+ sq ft of warehouse space across BC and...","","Vancouver, British Columbia","Rolls Right Trucking Industries","logistics|transportation|warehousing","/bc-ai-directory/people/eric-ramirez","2026-05-13"
"person:erica-hargreave","erica-hargreave","Erica Hargreave","Erica Hargreave is a BC-based transmedia storyteller, filmmaker, and educator who founded Ahimsa Media (B-Corp certified cross-platform media company) and co-founded Roamancing, a travel and culture magazine. She co-created the documentary series ""Naturally Ours: Rediscovering Canada's Parks"" and has won international awards for writing, podcasting, and filmmaking. She is also an instructor and course developer at...","Erica Hargreave is a BC-based transmedia storyteller, filmmaker, and educator who founded Ahimsa Media (B-Corp certified cross-platform media company) and co-founded Roamancing,...","Founder|Instructor|Transmedia Storyteller","British Columbia","Ahimsa Media|BCIT|Roamancing|StoryToGo","community|digital-media|education|film|storytelling|transmedia","/bc-ai-directory/people/erica-hargreave","2026-05-13"
"person:erica-janzen","erica-janzen","Erica Lapadat-Janzen","Erica Lapadat-Janzen is a Vancouver-based new media artist and creative strategist who founded Ministry of Next (MoN), a future-focused creative studio exploring identity, digital culture, and AI-integrated design workflows. She has a background in art direction and production design from Vancouver's film industry (2017–2025) and has collaborated with SFU's Metacreation Lab on the Dreamscape project using the Auto...","Erica Lapadat-Janzen is a Vancouver-based new media artist and creative strategist who founded Ministry of Next (MoN), a future-focused creative studio exploring identity, digit...","Creative Strategist|Founder|New Media Artist","Vancouver, British Columbia","Ministry of Next","ai-art|creative-strategy|digital-culture|identity-design|new-media-art","/bc-ai-directory/people/erica-janzen","2026-05-15"
"person:erik-sturgeon","erik-sturgeon","Erik Sturgeon","Erik Sturgeon is Founder and CEO of Quince Analytics Inc., a Vancouver-based company incorporated May 3, 2017. He has 28 years of wholesale and retail experience and developed what his company describes as the most efficient retail produce ordering system on the market. Quince Analytics piloted Chatnels' AI-powered chat messaging platform for use in the fresh produce procurement market segment. Community member in...","Erik Sturgeon is Founder and CEO of Quince Analytics Inc., a Vancouver-based company incorporated May 3, 2017. He has 28 years of wholesale and retail experience and developed w...","Founder & CEO, Quince Analytics Inc.","Vancouver, BC","Quince Analytics Inc.","ai-consulting|produce-ordering|quince-analytics|retail|saas","/bc-ai-directory/people/erik-sturgeon","2026-05-15"
"person:erika-foulkes","erika-foulkes","Erika Foulkes","Erika Foulkes is a co-lead and curator of DEFRAG, the creative AI event series running under Philippe Pasquier's Canada Arts Council-funded research at SFU's Metacreation Lab. She co-curates the artistic and performance programming for DEFRAG events, which are attached to the front of the BC + AI Festival Week. Her work focuses on the intersection of creative practice, emerging technology, and cultural production....","Erika Foulkes is a co-lead and curator of DEFRAG, the creative AI event series running under Philippe Pasquier's Canada Arts Council-funded research at SFU's Metacreation Lab. S...","DEFRAG Co-Lead and Curator","Vancouver, BC","BC + AI|SFU Metacreation Lab","creative-ai|defrag|festival-week|partner","/bc-ai-directory/people/erika-foulkes","2026-05-15"
"person:erin","erin","Erin","Erin is a community member who attended Vancouver AI Community events.","Erin is a community member who attended Vancouver AI Community events.","Community Member","Vancouver, BC","","","/bc-ai-directory/people/erin","2026-05-15"
"person:esme-wren","esme-wren","Esme Wren","Esme Wren is the Editor of Channel 4 News at ITN, appointed in January 2022 after leading BBC Newsnight for three years. At Newsnight she oversaw the landmark Prince Andrew interview (multiple industry awards) and recruited an all-women presenting team. Before the BBC she spent 12 years at Sky News, rising to Head of Politics, Business and Specialist Journalism. Channel 4 News won News Provider of the Year at the...","Esme Wren is the Editor of Channel 4 News at ITN, appointed in January 2022 after leading BBC Newsnight for three years. At Newsnight she oversaw the landmark Prince Andrew inte...","Editor, Channel 4 News","London, United Kingdom","Channel 4 News|ITN","broadcast|editorial-leadership|journalism|media","/bc-ai-directory/people/esme-wren","2026-05-13"
"person:evan-digby","evan-digby","Evan Digby","Evan Digby is a distributed systems specialist with 25+ years of experience building services across space/aerospace, defence, utility, construction, and games. He is Director and Distributed Systems Research Fellow at AIM Defence, leading the company's Canadian subsidiary in Vancouver — an appointment announced publicly in December 2024 as part of AIM Defence's international expansion. Previously a Principal Soft...","Evan Digby is a distributed systems specialist with 25+ years of experience building services across space/aerospace, defence, utility, construction, and games. He is Director a...","Director, Research Fellow","Vancouver, British Columbia","AIM Defence, Inc","aerospace|ai|defence|distributed-systems|leadership|research","/bc-ai-directory/people/evan-digby","2026-05-14"
"person:evita-kalnina","evita-kalnina","Evita Kalnina","Evita Kalnina is a Client Relationship Manager at Mintos, the European peer-to-peer lending and investment marketplace, based in North Vancouver, BC. With 18 years of professional experience, she is fluent in Latvian, English, Italian, and Spanish, and holds a Bachelor's degree from Latvijas Universitate and a CELTA QCF from the University of Cambridge. Her background spans sales management, fashion design, art, a...","Evita Kalnina is a Client Relationship Manager at Mintos, the European peer-to-peer lending and investment marketplace, based in North Vancouver, BC. With 18 years of profession...","Client Relationship Manager|Community Member","North Vancouver, BC","Mintos","ai-community|client-relations|fintech|multilingual|peer-to-peer-lending","/bc-ai-directory/people/evita-kalnina","2026-05-15"
"person:farbod-tabaei","farbod-tabaei","Farbod Tabaei","Farbod Tabaei sparked ""most intellectually rigorous debate"" in Applied & Industrial AI channel (October 26, 2025) with essay ""Humans Should Focus on Data Collection, Let AI Handle Analysis to Accelerate Breakthroughs."" Core thesis: Humans excel at observation/context/experiment design, AI excels at scale/pattern recognition/hypothesis generation, optimal partnership accelerates scientific breakthroughs. Kris Krüg'...","Farbod Tabaei sparked ""most intellectually rigorous debate"" in Applied & Industrial AI channel (October 26, 2025) with essay ""Humans Should Focus on Data Collection, Let AI Hand...","Community Member","Vancouver, BC","Electronic Arts (EA)","ai|gaming|philosophy","/bc-ai-directory/people/farbod-tabaei","2026-05-13"
"person:farid-azar","farid-azar","Farid Azar","Farid Azar is a BC + AI community member based in Vancouver, BC, active in the bcaievents channel in July 2025. Limited public information is available beyond community participation.","Farid Azar is a BC + AI community member based in Vancouver, BC, active in the bcaievents channel in July 2025. Limited public information is available beyond community particip...","Community Member","Vancouver, BC","","bc-ai","/bc-ai-directory/people/farid-azar","2026-05-13"
"person:fatima-travassos","fatima-travassos","Fatima Travassos","Fatima Travassos is a Vancouver-based digital artist and designer who transitioned from fashion styling and menswear buying into AI-assisted creative work. She runs Fatima Travassos Art + Design and is known for AI fashion design and immersive short films, having won multiple AI fashion design competitions and been featured in international art magazines. Her work spans AI-driven fashion campaigns, digital art, an...","Fatima Travassos is a Vancouver-based digital artist and designer who transitioned from fashion styling and menswear buying into AI-assisted creative work. She runs Fatima Trava...","AI Fashion Designer|Digital Artist|Graphic Designer","Vancouver, British Columbia","Fatima Travassos Art + Design","ai|art|creative-ai|design|fashion|film","/bc-ai-directory/people/fatima-travassos","2026-05-13"
"person:feisal","feisal","Feisal","Feisal is a BC + AI community member active in the bcaiannouncements, bcaijobs, and bcaifilmclub channels from March to October 2025. First name only; limited public information available.","Feisal is a BC + AI community member active in the bcaiannouncements, bcaijobs, and bcaifilmclub channels from March to October 2025. First name only; limited public information...","Community Member","Vancouver, BC","","bc-ai","/bc-ai-directory/people/feisal","2026-05-13"
"person:feisal-ahmad","feisal-ahmad","Feisal Ahmad","Feisal Ahmad is BC + AI Founding Member 64, joining the organization in September 2025. Limited public professional information is available beyond founding member status.","Feisal Ahmad is BC + AI Founding Member 64, joining the organization in September 2025. Limited public professional information is available beyond founding member status.","Founding Member","Vancouver, BC","","bc-ai|founding-member","/bc-ai-directory/people/feisal-ahmad","2026-05-13"
"person:felipe-martinez","felipe-martinez","Felipe Martinez","Felipe Martinez is a BC + AI community member active in the bcaiannouncements channel in September 2025. Limited public information is available beyond community participation.","Felipe Martinez is a BC + AI community member active in the bcaiannouncements channel in September 2025. Limited public information is available beyond community participation.","Community Member","Vancouver, BC","","bc-ai","/bc-ai-directory/people/felipe-martinez","2026-05-13"
"person:fergus","fergus","Fergus","Fergus is a BC + AI community member active in the braintrust channel from March to November 2025. First name only; limited public information available.","Fergus is a BC + AI community member active in the braintrust channel from March to November 2025. First name only; limited public information available.","Community Member","Vancouver, BC","","bc-ai","/bc-ai-directory/people/fergus","2026-05-13"
"person:fermi-perumal","fermi-perumal","Fermi Perumal","Fermi Perumal is Pipeline Lead at Stellar Creative Lab, a high-end animation and VFX studio in Vancouver with teams in Toronto and Costa Rica. The studio has produced content for Disney+, Prime Video, and has worked with Marvel Studios and Disney on features and series. Fermi attended the Vancouver AI Community meetup in January 2025 and shared feedback on the event format.","Fermi Perumal is Pipeline Lead at Stellar Creative Lab, a high-end animation and VFX studio in Vancouver with teams in Toronto and Costa Rica. The studio has produced content fo...","Pipeline Lead","Vancouver, British Columbia","Stellar Creative Lab","ai|animation|pipeline|vfx","/bc-ai-directory/people/fermi-perumal","2026-05-13"
"person:fernanda","fernanda","Fernanda","Fernanda is a BC + AI community member active in the bcaiannouncements, bcaievents, and bcaijobs channels in August 2025. First name only; limited public information available.","Fernanda is a BC + AI community member active in the bcaiannouncements, bcaievents, and bcaijobs channels in August 2025. First name only; limited public information available.","Community Member","Vancouver, BC","","bc-ai","/bc-ai-directory/people/fernanda","2026-05-13"
"person:fiann-o-hagen","fiann-o-hagen","Fiann O'Hagen","Fiann O'Hagen: 302 messages across 4 channels (MAC 202 = 67%, 5 contributor; Hackathon 43; March-Nov 2025, 7+ months). Playwright Debugging Pattern - Canonical Workflow (June 13, 2025 Hackathon): screenshot memory (Claude Code remembers visual state), iterative debugging (Run → screenshot → analyze → fix), performance testing (Lighthouse scores via Playwright). Becomes canonical - others adopt pattern, visual debu...","Fiann O'Hagen: 302 messages across 4 channels (MAC 202 = 67%, 5 contributor; Hackathon 43; March-Nov 2025, 7+ months). Playwright Debugging Pattern - Canonical Workflow (June 13...","Community Member","Vancouver, BC","","ai|biology|consciousness|web-performance","/bc-ai-directory/people/fiann-o-hagen","2026-05-13"
"person:finn","finn","Finn","Finn made small donation to BC + AI youth program (""Yo, I'd love to make a small donation to the org for just being helpful and stuff"") that sparked formalization of entire $2,500 youth scholarship fund - sometimes catalyst isn't biggest gesture but first one that makes everyone realize ""oh, we can actually do this."" Has 30-year-old neuroscience undergrad degree from 1990s that suddenly matters again after watchin...","Finn made small donation to BC + AI youth program (""Yo, I'd love to make a small donation to the org for just being helpful and stuff"") that sparked formalization of entire $2,5...","Community Member","Vancouver, BC","","bc-ai|consciousness|data-for-good|neuroscience","/bc-ai-directory/people/finn","2026-05-13"
"person:floyd-mann","floyd-mann","Floyd Mann","Floyd Mann is Lead Web Developer at Affinity Bridge, a Certified B Corp digital agency in Vancouver dedicated to empowering social change organizations. He brings 20 years of development experience with deep expertise in Drupal, and has been leading backend development at Affinity Bridge since 2014. A long-time open source developer, he is now exploring AI-driven development. Outside tech, he runs The Fresh Loaf,...","Floyd Mann is Lead Web Developer at Affinity Bridge, a Certified B Corp digital agency in Vancouver dedicated to empowering social change organizations. He brings 20 years of de...","Lead Web Developer","Vancouver, British Columbia","Affinity Bridge","ai|community|developer|drupal|open-source","/bc-ai-directory/people/floyd-mann","2026-05-13"
