"id","slug","name","summary","excerpt","roles","locations","organizations","tags","profileUrl","lastUpdated"
"person:prajwal-prasanth","prajwal-prasanth","Prajwal Prasanth","Prajwal Prasanth is the DevOps Manager for the BC + AI Community and a Langara College valedictorian (96.43% GPA) heading to UBC Engineering Physics. He won first place at the Vancouver AI hackathon (August 2024, $2,500+ prize) just weeks after graduating high school, with a semantic mapping and AI roundtable project that drew immediate hiring interest from judges at Rival Technologies. He independently discovered...","Prajwal Prasanth is the DevOps Manager for the BC + AI Community and a Langara College valedictorian (96.43% GPA) heading to UBC Engineering Physics. He won first place at the V...","DevOps Manager, BC + AI Community|Student, UBC Engineering Physics","British Columbia","BC + AI Ecosystem Association|Langara College|UBC","ai-ml|devops|education|engineer|hackathon-winner","/bc-ai-directory/people/prajwal-prasanth","2026-05-15"
"person:prashant-agrawal","prashant-agrawal","Prashant Agrawal","Prashant Agrawal is a Growth Strategist and Transformation Consultant at SPStarworks in North Vancouver, BC. He organizes Vancouver Startup Week (VSW), a major annual tech event series coordinating dozens of events across multiple platforms. He is known in the BC + AI community as ""Mr. P"" — a nickname coined by Kris Krüg after Prashant flagged a scam event with documented evidence and helped establish a distribute...","Prashant Agrawal is a Growth Strategist and Transformation Consultant at SPStarworks in North Vancouver, BC. He organizes Vancouver Startup Week (VSW), a major annual tech event...","Event Organizer|Growth Strategist|Transformation Consultant","North Vancouver, British Columbia","SPStarworks|Vancouver Startup Week","ai-ml|digital-transformation|event-organizing|growth-strategy|startup","/bc-ai-directory/people/prashant-agrawal","2026-05-15"
"person:prashanth-narasimha-murthy","prashanth-narasimha-murthy","Prashanth Narasimha Murthy","Prashanth Narasimha Murthy is a Digital Program Manager based in Canada, with a background in software development and program management, including roles at Sonata Software and work with Dynamics AX ERP systems. He attended Vancouver AI Community events from May 2025.","Prashanth Narasimha Murthy is a Digital Program Manager based in Canada, with a background in software development and program management, including roles at Sonata Software and...","AI Community Member|Digital Program Manager","Vancouver, BC","","","/bc-ai-directory/people/prashanth-narasimha-murthy","2026-05-15"
"person:praveen-pillay","praveen-pillay","Praveen Pillay","Praveen Pillay (Move37XR founder, Doctors Without Borders board member, Center for Global Health Research fellow) brought planetary boundaries urgency and non-human intelligence partnership framework to Vancouver AI: ""Is there a way that there can be a symbiotic relationship with a non-human consciousness or intelligence?"" Move 37 philosophy: AlphaGo's unprecedented Go move (2,000 years human play never conceived)...","Praveen Pillay (Move37XR founder, Doctors Without Borders board member, Center for Global Health Research fellow) brought planetary boundaries urgency and non-human intelligence...","Community Member","Vancouver, BC","","","/bc-ai-directory/people/praveen-pillay","2026-05-15"
"person:praveen-viswanath","praveen-viswanath","Praveen Viswanath","Praveen Viswanath is a pioneering technology leader and Chief Architect based in Vancouver, BC, with a $100M+ exit in his background. He co-founded Alpha Ori Technologies (AOT), helping grow it from startup to industry disruptor, and has been involved with Armada (sovereign AI at the edge) and related AI infrastructure ventures. Praveen is also a leader in the Inclusive AI Foundation, a Vancouver-based nonprofit d...","Praveen Viswanath is a pioneering technology leader and Chief Architect based in Vancouver, BC, with a $100M+ exit in his background. He co-founded Alpha Ori Technologies (AOT),...","AI & Cybersecurity Leader|AI Community Member|Chief Architect|Inclusive AI Foundation","Vancouver, BC","Armada|Inclusive AI Foundation","","/bc-ai-directory/people/praveen-viswanath","2026-05-15"
"person:pravin-pillay","pravin-pillay","Pravin Pillay","Pravin Pillay is founder and Creative Director of MOVE37XR, a networked not-for-profit creative studio and emerging media research lab. He is also co-founder and Managing Director of Humanitas Smart Planet Systems (climate and social technology VC), Senior Advisor for Technology, Innovation, and Strategy at the Global Centre of Indigenomics, and a Community Fellow at the Dahdaleh Institute for Global Health Resear...","Pravin Pillay is founder and Creative Director of MOVE37XR, a networked not-for-profit creative studio and emerging media research lab. He is also co-founder and Managing Direct...","Community Fellow, Dahdaleh Institute for Global Health Research|Founder & Creative Director, MOVE37XR|Senior Advisor, Global Centre of Indigenomics","Metchosin, BC|Salt Spring Island, BC","Dahdaleh Institute for Global Health Research|Doctors Without Borders|Global Centre of Indigenomics|Humanitas Smart Planet Systems|MOVE37XR","global-health|immersive-reality|indigenous-ai|non-human-intelligence|planetary-boundaries|social-entrepreneurship","/bc-ai-directory/people/pravin-pillay","2026-05-15"
"person:puma-jeremy-bayley","puma-jeremy-bayley","Puma (Jeremy) Bayley","Puma (Jeremy) Bayley BC + AI Founding Member 11. Jeremy Bayley (known as Puma) is a video producer based in Vancouver, BC, and founder of VidBacon, a video production company. He is one of the earliest members of the BC + AI ecosystem, joining in August 2025. Professional Information - Company: VidBacon (video production) - Location: Vancouver, British Columbia BC + AI Founding Member - Member Number: 11 - Profile...","Puma (Jeremy) Bayley BC + AI Founding Member 11. Jeremy Bayley (known as Puma) is a video producer based in Vancouver, BC, and founder of VidBacon, a video production company. H...","BC + AI Founding Member|Founder|Video Producer","Vancouver, British Columbia","BC + AI|VidBacon","bc-ai|creative|founding-member|video-production","/bc-ai-directory/people/puma-jeremy-bayley","2026-05-15"
"person:quana-parker","quana-parker","Quana Parker","Quana Parker is a Vancouver-based technology professional working at Meta, with 500+ LinkedIn connections. He holds a certification in Tools for Data Science from Coursera and has been involved in the Comox Valley AI Community Meetup. Colleagues note his thoughtful problem-solving approach and generosity in sharing knowledge.","Quana Parker is a Vancouver-based technology professional working at Meta, with 500+ LinkedIn connections. He holds a certification in Tools for Data Science from Coursera and h...","Software Engineer / Data Science","Vancouver, BC","Meta","ai|data-science|meta|software-engineering","/bc-ai-directory/people/quana-parker","2026-05-15"
"person:rabab-altarazi","rabab-altarazi","Rabab Altarazi","Rabab Altarazi graduated from Simon Fraser University's School of Interactive Arts & Technology (SIAT) with a B.Sc. concentration in AI and Data Science for Human-Centered Systems. She made the Dean's Honour Roll during her studies. Her work spans UX, web development, 3D, VR, and data- and AI-driven projects. She showcased a generative art project called ""Chaotic Harmony"" at the Vancouver AI Meetup — created as he...","Rabab Altarazi graduated from Simon Fraser University's School of Interactive Arts & Technology (SIAT) with a B.Sc. concentration in AI and Data Science for Human-Centered Syste...","AI & Data Science Graduate (SFU SIAT)|AI Community Member|TELUS Health","Vancouver, BC","Simon Fraser University — School of Interactive Arts & Technology (SIAT)|TELUS Health","","/bc-ai-directory/people/rabab-altarazi","2026-05-15"
"person:rachel-grillot","rachel-grillot","Rachel Grillot, Ph.D.","Rachel Grillot, Ph.D., is VP of Global Solution Consulting at IFS Copperleaf in North Vancouver, where she leads a global team delivering data-driven solutions for strategic asset management and digital transformation. She is an executive leader pioneering AI transformation across global enterprises, with a passion for driving business outcomes through technology. She is seasoned in value optimization and aligning...","Rachel Grillot, Ph.D., is VP of Global Solution Consulting at IFS Copperleaf in North Vancouver, where she leads a global team delivering data-driven solutions for strategic ass...","AI Community Member|AI Transformation Leader|VP, Global Solution Consulting — IFS Copperleaf","North Vancouver, BC","IFS Copperleaf","","/bc-ai-directory/people/rachel-grillot","2026-05-15"
"person:rachel-horst","rachel-horst","Rachel Horst","Dr. Rachel Horst is a Lecturer and Academic Advisor in UBC's Master of Educational Technology (MET) program, where she teaches courses on AI in Education, futures literacies, and critical digital literacies. She holds a PhD in Language and Literacy Education from UBC and is a former secondary school teacher. In 2026 she presented ""Hyperstition: Hacking Creativity and LLMs in Education"" at the BC + AI AI + Educatio...","Dr. Rachel Horst is a Lecturer and Academic Advisor in UBC's Master of Educational Technology (MET) program, where she teaches courses on AI in Education, futures literacies, an...","Academic Advisor|Lecturer|Speaker","Vancouver, British Columbia","University of British Columbia","ai-education|digital-literacies|edtech|futures-literacies|ubc","/bc-ai-directory/people/rachel-horst","2026-05-15"
"person:rae-paziuk","rae-paziuk","Rae Paziuk","Rae Paziuk is a Vancouver-based UX designer and film art department professional. She has worked as a Senior User Experience Designer at Amazon Web Services and has IMDb credits for art department work on productions including Fantastic Four: Rise of the Silver Surfer (2007) and Supernatural. Colleagues describe her as an enormously talented and intuitive UX designer whose skills extend beyond interface design. Sh...","Rae Paziuk is a Vancouver-based UX designer and film art department professional. She has worked as a Senior User Experience Designer at Amazon Web Services and has IMDb credits...","Art Department (Film)|Senior UX Designer","Vancouver, BC","Amazon Web Services","ai-film-club|digital-media|film-art-department|ux-design","/bc-ai-directory/people/rae-paziuk","2026-05-15"
"person:rafael-arias-gonzalez","rafael-arias-gonzalez","Rafael Arias Gonzalez","Rafael Arias Gonzalez is a Vancouver-based AI researcher and educator. He completed an MSc in Artificial Intelligence at SFU's School of Interactive Arts & Technology (SIAT) in 2021–2024, where he developed a cognitive memory large language model enabling users to interact with historical figures (e.g., Van Gogh via 800+ letters). He presented this work at NeurIPS — one of the field's top venues — and is part of S...","Rafael Arias Gonzalez is a Vancouver-based AI researcher and educator. He completed an MSc in Artificial Intelligence at SFU's School of Interactive Arts & Technology (SIAT) in...","AI Researcher|Instructor, Vancouver Film School","Vancouver, BC","SFU iViz Lab|SFU School of Interactive Arts & Technology (SIAT)|Vancouver Film School","ai-research|cognitive-ai|creative-ai|game-design|neurips|nlp","/bc-ai-directory/people/rafael-arias-gonzalez","2026-05-15"
"person:raif-adelberg","raif-adelberg","Raif Adelberg","Raif Adelberg is a leading Canadian fashion designer and creative entrepreneur from Vancouver. He is the founder of Wings+Horns, Maison François Marie, HerMan, Made Magazine, and the Richard Kidd concept boutique in Vancouver's Gastown. He brings over two decades of design experience combining craftsmanship, culture, and contemporary luxury. As of 2025 he serves as Design Director for Moose Knuckles, a Montreal-ba...","Raif Adelberg is a leading Canadian fashion designer and creative entrepreneur from Vancouver. He is the founder of Wings+Horns, Maison François Marie, HerMan, Made Magazine, an...","Creative Director & Designer|Founder","Vancouver, BC","Moose Knuckles|Richard Kidd|Wings+Horns","brand-strategy|creative-direction|design|fashion|retail","/bc-ai-directory/people/raif-adelberg","2026-05-15"
"person:ramin-estifaie","ramin-estifaie","Ramin Estifaie","Ramin Estifaie is Co-Founder and CEO of CSN Pharma, a GMP and SQF certified sports nutrition and nutraceutical manufacturer based in North Vancouver, BC. He has driven strategic business development and partnerships since founding the company in September 2017. CSN Pharma was nominated as one of the top 3 finalists for Business Distinction Awards by the Greater Vancouver Board of Trade.","Ramin Estifaie is Co-Founder and CEO of CSN Pharma, a GMP and SQF certified sports nutrition and nutraceutical manufacturer based in North Vancouver, BC. He has driven strategic...","Co-Founder & CEO","North Vancouver, BC","CSN Pharma","entrepreneur|manufacturing|nutraceuticals|pharma|sports-nutrition","/bc-ai-directory/people/ramin-estifaie","2026-05-15"
"person:raphael-yeung","raphael-yeung","Raphael Yeung, CFA","Raphael Yeung, CFA, is Managing Director, Head of Investment Banking, and Co-Founder of Centurion One Capital Corp., a Vancouver-based independent investment banking firm focused on fueling growth companies in North America. The firm applies merchant banking principles — principal investments with aligned incentives — and hosts major investment summits including the Annual LA Summit. Raphael brings over 10 years o...","Raphael Yeung, CFA, is Managing Director, Head of Investment Banking, and Co-Founder of Centurion One Capital Corp., a Vancouver-based independent investment banking firm focuse...","AI Community Member|Co-Founder, Centurion One Capital Corp.|Managing Director & Head of Investment Banking","Vancouver, BC","Centurion One Capital Corp.","","/bc-ai-directory/people/raphael-yeung","2026-05-15"
"person:reza-azizi","reza-azizi","Reza Azizi","Reza Azizi is a software developer at Circuit Logic Labs in North Vancouver, BC. He specializes in AI applications and services, leveraging machine learning to build innovative solutions for real-world problems. He has written about AI and spec-driven development on Medium, with a focus on practical AI engineering applications. An active member of the Vancouver AI community, he attended the February 2026 meetup an...","Reza Azizi is a software developer at Circuit Logic Labs in North Vancouver, BC. He specializes in AI applications and services, leveraging machine learning to build innovative...","Software Developer","North Vancouver, British Columbia","Circuit Logic Labs","ai-ml|machine-learning|software-development","/bc-ai-directory/people/reza-azizi","2026-05-15"
"person:reza-gholizadeh","reza-gholizadeh","Reza Gholizadeh","Reza Gholizadeh is a Senior Software Engineer at Lendesk in Vancouver, BC, with 6+ years of experience building scalable systems. He holds a Bachelor's from Amirkabir University of Technology (Tehran Polytechnic) and a Master's from the University of Calgary. Previous roles include Senior Software Engineer at Stocky AI and Replicon. His research work on ""Carbon-Aware and Latency-Efficient Scheduling for Geo-Distri...","Reza Gholizadeh is a Senior Software Engineer at Lendesk in Vancouver, BC, with 6+ years of experience building scalable systems. He holds a Bachelor's from Amirkabir University...","AI Community Member|AI/ML Researcher|Senior Software Engineer","Vancouver, BC","Lendesk","","/bc-ai-directory/people/reza-gholizadeh","2026-05-15"
"person:ria-voulakis","ria-voulakis","Ria Voulakis","Ria Voulakis is a multidisciplinary designer and educator based in West Vancouver, BC, working at the intersection of fashion, visual communication, and emerging technology. She is associated with the Fashion Innovation Centre (fashionic.ca) and teaches at JCI Institute Inc., Langara College, and VCAD. Her practice integrates creative AI tools into fashion and design education. She is a BC + AI Founding Member (162).","Ria Voulakis is a multidisciplinary designer and educator based in West Vancouver, BC, working at the intersection of fashion, visual communication, and emerging technology. She...","Educator|Multidisciplinary Designer","West Vancouver, British Columbia","Fashion Innovation Centre (fashionic.ca)|JCI Institute Inc.|Langara College|VCAD","ai-ml|creative-tech|design|education|fashion-tech|founding-member","/bc-ai-directory/people/ria-voulakis","2026-05-15"
"person:ric-holland","ric-holland","Ric Holland","Ric Holland is a contact in the BC + AI directory network. Limited public info available.","Ric Holland is a contact in the BC + AI directory network. Limited public info available.","","","","","/bc-ai-directory/people/ric-holland","2026-05-14"
"person:ricardo-torres","ricardo-torres","Ricardo Torres","Ricardo Torres is a Previsualization and Layout Artist at Industrial Light & Magic (ILM) in Vancouver (Burnaby), with experience across VFX and full-CG feature films and TV series. He has leadership experience and a background training animation and film students. He is an innovation enthusiast engaged in the intersection of AI and visual effects production.","Ricardo Torres is a Previsualization and Layout Artist at Industrial Light & Magic (ILM) in Vancouver (Burnaby), with experience across VFX and full-CG feature films and TV seri...","founding-member|Previsualization/Layout Artist","Burnaby, British Columbia","Industrial Light & Magic","animation|bc-ai|founding-member|previs|vfx","/bc-ai-directory/people/ricardo-torres","2026-05-15"
"person:richard","richard","Richard","Richard is a community member who attended Vancouver AI Community events.","Richard is a community member who attended Vancouver AI Community events.","Community Member","Vancouver, BC","","","/bc-ai-directory/people/richard","2026-05-15"
"person:rick-ahn","rick-ahn","Rick Ahn","Rick Ahn is a contact in the BC + AI directory network. Limited public info available.","Rick Ahn is a contact in the BC + AI directory network. Limited public info available.","","","","","/bc-ai-directory/people/rick-ahn","2026-05-14"
"person:rick-bellairs","rick-bellairs","Rick Bellairs","Rick Bellairs is a community member who attended Vancouver AI Community events (first seen November 2025). He left an enthusiastic 5-star review for the ""Mind, AI, and Consciousness Deepdive 007"" event, praising Loki Jorgensen's presentation style and noting the talk prompted genuine intellectual fascination. No distinct public professional profile was confirmed in this enrichment pass.","Rick Bellairs is a community member who attended Vancouver AI Community events (first seen November 2025). He left an enthusiastic 5-star review for the ""Mind, AI, and Conscious...","AI Community Member","Vancouver, BC","","","/bc-ai-directory/people/rick-bellairs","2026-05-15"
"person:ricky-sutton","ricky-sutton","Ricky Sutton","Ricky Sutton is a contact in the BC + AI directory network. Limited public info available.","Ricky Sutton is a contact in the BC + AI directory network. Limited public info available.","","","","","/bc-ai-directory/people/ricky-sutton","2026-05-14"
"person:rnold-smith","rnold-smith","Rnold Smith","Rnold Smith (sometimes referred to as ""Arnold"" in transcripts) specializes in leadership development and culture transformation, with deep interest in technology-supported behavior change. In 2018, built an app designed to help people implement behaviors that cause positive physiological responses in others. Long-term goal: help humanity evolve beyond fear. In January 2026, Rnold stepped up to help shepherd the AI...","Rnold Smith (sometimes referred to as ""Arnold"" in transcripts) specializes in leadership development and culture transformation, with deep interest in technology-supported behav...","","","","","/bc-ai-directory/people/rnold-smith","2026-05-15"
"person:rob-arthurs","rob-arthurs","Rob Arthurs","Rob Arthurs is President and Founder of Robert Arthurs International, a North Vancouver-based international trade and business development consultancy. With 36+ years of executive experience across agri-food/agri-tech, digital marketing, seafood, natural supplements, and global trade, he spent 14 years with the BC government's international trade development division, facilitating 30+ trade missions and connecting...","Rob Arthurs is President and Founder of Robert Arthurs International, a North Vancouver-based international trade and business development consultancy. With 36+ years of executi...","President","North Vancouver, British Columbia","Robert Arthurs International","ai|business-development|entrepreneurship|fifa-2026|international-trade","/bc-ai-directory/people/rob-arthurs","2026-05-15"
"person:rob-goehing-ainbc","rob-goehing-ainbc","Rob Goehing AINBC","Rob Goehing AINBC is a contact in the BC + AI directory network. Limited public info available.","Rob Goehing AINBC is a contact in the BC + AI directory network. Limited public info available.","","","","","/bc-ai-directory/people/rob-goehing-ainbc","2026-05-14"
"person:rob-rosenberg","rob-rosenberg","Rob Rosenberg","Rob Rosenberg is a contact in the BC + AI directory network. Limited public info available.","Rob Rosenberg is a contact in the BC + AI directory network. Limited public info available.","","","","","/bc-ai-directory/people/rob-rosenberg","2026-05-14"
"person:robert-davidson","robert-davidson","Robert Davidson","Robert Davidson is founder of Enlighten Medical in Courtenay, BC, leading a team of six scientists on projects including a hop-latent viroid cure, plant clock genes for food security, and DNA data storage. He brings 22 years as Global Market Development Manager at Life Technologies (now Thermo Fisher Scientific), where he built global relationships with the Karolinska Institute, RIKEN Japan, and other major resear...","Robert Davidson is founder of Enlighten Medical in Courtenay, BC, leading a team of six scientists on projects including a hop-latent viroid cure, plant clock genes for food sec...","Founder|founding-member|Life Sciences Expert","Courtenay, British Columbia","Enlighten Medical|Life Technologies (former)","bc-ai|biotechnology|comox-valley|founding-member|human-genome|life-sciences","/bc-ai-directory/people/robert-davidson","2026-05-15"
"person:robert-delamar","robert-delamar","Robert Delamar","Robert ""Bob"" Delamar is an entrepreneur and lawyer serving as CEO of Kanata Clean Power, a decarbonization company developing net-zero hydrogen and ammonia projects across North America. Kanata's largest shareholder is Frog Lake First Nations, making it a First Nations co-founded cleantech venture. Bob brings over two decades of experience including founding international digital media companies, co-founding Pacif...","Robert ""Bob"" Delamar is an entrepreneur and lawyer serving as CEO of Kanata Clean Power, a decarbonization company developing net-zero hydrogen and ammonia projects across North...","AI Community Member|CEO, Kanata Clean Power|Entrepreneur & Lawyer","Vancouver, BC","Kanata Clean Power","","/bc-ai-directory/people/robert-delamar","2026-05-15"
"person:robert-michael-murphy","robert-michael-murphy","Robert Michael Murphy","Robert Michael Murphy is a contact in the BC + AI directory network. Limited public info available.","Robert Michael Murphy is a contact in the BC + AI directory network. Limited public info available.","","","","","/bc-ai-directory/people/robert-michael-murphy","2026-05-14"
"person:robert-michael-murray","robert-michael-murray","Robert Michael Murray","Robert Michael Murray is a contact in the BC + AI directory network. Limited public info available.","Robert Michael Murray is a contact in the BC + AI directory network. Limited public info available.","","","","","/bc-ai-directory/people/robert-michael-murray","2026-05-14"
"person:robert-sabin","robert-sabin","Robert Sabin","Robert Sabin is a contact in the BC + AI directory network. Limited public info available.","Robert Sabin is a contact in the BC + AI directory network. Limited public info available.","","","","","/bc-ai-directory/people/robert-sabin","2026-05-14"
"person:robert-scales","robert-scales","Robert Scales","Robert Scales is Chief Strategist at Holistic Hybrid, a Canada-based consultancy focused on AI strategy, business development, and emerging technologies. He has 25+ years of experience with Fortune 500 companies and is the author of ""A Beginner's Guide to ChatGPT."" He studied at BCIT and is active in the Vancouver AI community, particularly around AI education and application.","Robert Scales is Chief Strategist at Holistic Hybrid, a Canada-based consultancy focused on AI strategy, business development, and emerging technologies. He has 25+ years of exp...","AI Educator & Consultant|Author|Chief Strategist, Holistic Hybrid","Canada (BC)","Holistic Hybrid","ai-education|bcit-alumnus|emerging-technology","/bc-ai-directory/people/robert-scales","2026-05-15"
"person:roberto-cervantes","roberto-cervantes","Roberto Cervantes","Roberto Cervantes is the Co-Founder and CEO of Flowlly, a Vancouver-based AI-driven platform revolutionizing project management in the architecture-engineering-construction (AEC) industry through AI agents that automate document processing and meeting minutes. He previously co-founded CryptoNumerics (an AI software company acquired by Snowflake) and Codestory (automated API documentation). He is a BUILDEX Vancouve...","Roberto Cervantes is the Co-Founder and CEO of Flowlly, a Vancouver-based AI-driven platform revolutionizing project management in the architecture-engineering-construction (AEC...","Co-Founder & CEO","Vancouver, BC","Codestory|CryptoNumerics|Flowlly","aec|ai|ai-agents|construction-tech|entrepreneurship|saas","/bc-ai-directory/people/roberto-cervantes","2026-05-15"
